{
  "schema_version": "2.0.0",
  "finding_id": "FIND-RUN001-OBS",
  "run_id": "RUN-EXAMPLE-001",
  "case_id": "VAD-PAUSE-800",
  "execution_kind": "synthetic",
  "kind": "observation",
  "title": "Synthetic example: response starts after complete utterance",
  "severity": null,
  "status": "confirmed",
  "description": "Contract illustration only; no physical device was tested.",
  "expected_behavior": "Observe device speech relative to final tester speech end.",
  "actual_behavior": "Synthetic onset 5480 ms follows tester end 4100 ms.",
  "confidence": 0.9,
  "attribution_status": "unknown",
  "attribution_confidence": 0,
  "suspected_layers": [
    "unknown"
  ],
  "requires_log_verification": false,
  "evidence_ids": [
    "EVD-OBSERVATION",
    "EVD-EVT-006",
    "EVD-EVT-007"
  ],
  "event_ids": [
    "EVT-006",
    "EVT-007"
  ],
  "metric_ids": [
    "METRIC-RUN001-LATENCY"
  ],
  "human_review": {
    "status": "not_required",
    "reviewer": null,
    "reviewed_at": null
  },
  "origin": "manual",
  "regression_case_candidate": false
}
